{"assertion":{"artifact_expires_at":"2026-10-13T18:27:06Z","artifact_id":10322284872,"artifact_name":"release-image-set-assertion-371cfa58a90888d12d6ae5a857275323ab3f43c4-34774398155","canonical_path":"docs/security-evidence/release-image-set-assertion-34774398155.canonical.json","canonical_size":9097,"sha256":"ffbfd017d6a2c4512beb5b9452a6cbc69ebb20a90c97716f2f35003a78154332","workflow_run_attempt":1,"workflow_run_id":34774398155},"authority":"independent-static-release-image-set-review-record","claims":{"cloud_execution_observed":false,"exact_image_identity_closure_satisfied":true,"kubernetes_execution_observed":false,"production_ready":false,"provider_execution_observed":false,"readiness_promoted":false,"release_eligible":false,"release_image_set_present":true,"runtime_qualification_observed":false},"images":[{"buildkit_provenance_sha256":"e8acf71ba7dda21a176558ad78e3566723d84750722c0ace480e9a0628589374","exact_reference":"ghcr.io/nenb/cogs/worker@sha256:e6f26544a44ffc8cbda6973fb1ac771a7725482f3b722c69e6318ce018260e9e","linux_amd64_manifest_digest":"sha256:8763600c26fe9553d00e91bc44b8cdb9697fc1e0c135b4ba666a1cad2ba76555","role":"worker","sbom_sha256":"0a0a8dafaceaddb1c61728c9c09d33779a500f3c4aa5474a4e7e2d0bcef5f2b3","vulnerabilities":{"critical":0,"high":0,"low":7,"medium":14,"total":21,"unknown":0}},{"buildkit_provenance_sha256":"e2758779ff0ea7d321f766952c69c92a833079452a5898e8446c4e3b83e548da","exact_reference":"ghcr.io/nenb/cogs/sandbox@sha256:5652f75300f8ec31a50731140ae7bee4d4e205af964044b29c7433b02497231d","linux_amd64_manifest_digest":"sha256:c633a258fc64a95eaedf3ba162fe0929946c45109f15a001cb387ca0609c763d","role":"sandbox","sbom_sha256":"931fe6deca89d1a810cbcb2f3f86c7b3c950032373f8ff9f4ee55bcdedf9b642","vulnerabilities":{"critical":0,"high":0,"low":24,"medium":193,"total":217,"unknown":0}}],"observations":{"assertion_canonical_and_schema_valid":true,"buildkit_provenance_matched":true,"exact_certificate_constraints_verified":true,"independent_pinned_trivy_gate_reproduced":true,"linux_amd64_children_matched":true,"registry_index_digests_matched":true,"sandbox_dpkg_sbom_package_count":140,"source_tree_and_inventory_matched":true,"spdx_attestations_verified":true,"transparency_log_entries_verified":true,"transport_tags_matched_exact_indexes":true,"worker_fixed_undici_installations":1,"worker_fixed_undici_version":"8.9.0"},"review":{"assertion_parser_result":"VALID_WORKFLOW_ASSERTION_RECORD","procedure":"cogs-independent-release-image-set-review/v3","reviewed_at":"2026-09-13T18:40:42Z","reviewer":"nenb"},"source":{"image_source_inventory_sha256":"16f7898e8515b0ff4911da896a158fd10d0158fc69215978b89fbd56bd97f670","image_source_sha":"371cfa58a90888d12d6ae5a857275323ab3f43c4","image_source_tree_sha":"0280ec76da20db6f7059b97fffeaf31ac2a73845","relation_to_readiness_source":"separately-bound-immutable-image-source"},"version":"cogs.release-image-set-review/v3"}
